bodyType,brand,color,fuelType,modelDate,name,name_full,numberOfDoors,productionDate,vehicleConfiguration,vehicleTransmission,engineDisplacement,enginePower,description,mileage,equipment,drive,wheel,state,owners,pts,customs,owningTime,price
купе,bmw,серый,гибрид,2014,1.5hyb AT (231 л.с.) 4WD,BMW i8 I,2,2015,COUPE AUTOMATIC 1.5,автоматическая,1.5 LTR,231 N12,"Автомобиль продаётся официальным дилером BMW - компанией АВТОДОМ.Уважаемые клиенты, автомобиль представлен для Вашего осмотра на площадке АВТОДОМ - ""Зорге"", по адресу г.Москва, ул.Зорге д.17Состояние нового автомобиля.Оригинальный пробег составляет 1 598 км !!!Приобреталась новой в компании АВТОДОМ!Прозрачная история обслуживания!Единственный владелец!Только летняя эксплуатация!Комплектация «Базовая»:• Антиблокировочная система• Система курсовой устойчивости• Система контроля слепых зон• Система предотвращения столкновения• Подушки безопасности водителя• Подушки безопасности пассажира• Боковые передние подушки безопасности• Оконные шторки безопасности• Система крепления детских автокресел Isofix / LATCH• Сигнализация• Иммобилайзер• Центральный замок• Бортовой компьютер• Круиз-контроль• Парктроник передний и задний• Датчик света• Датчик дождя• Активный усилитель руля• Запуск двигателя с кнопки• Система доступа без ключа• Регулировка руля• Электрорегулировка сиденья пассажира• Электростеклоподъемники передние• Электропривод зеркал• Климат-контроль 1-зонный• Подогрев сидений водителя и пассажира• Навигационная система• CD• USB• Bluetooth• AUX• Hi-Fi• Аудиоподготовка• Мультифункциональное рулевое колесо• Розетка 12V• Кожаная обивка салона• Отделка потолка черной тканью• Кожаный руль• Передний центральный подлокотник• Размер дисков 20″• Светодиодные фары• Корректор фар",1 598 км,"{'Комфорт': ['Круиз-контроль', 'Электростеклоподъёмники передние', 'Мультифункциональное рулевое колесо', 'Бортовой компьютер', 'Система доступа без ключа', 'Активный усилитель руля', 'Электропривод зеркал', 'Запуск двигателя с кнопки', 'Парктроник передний', 'Регулировка руля по вылету', 'Регулировка руля по высоте', 'Климат-контроль 1-зонный', 'Электроскладывание зеркал', 'Парктроник задний'], 'Безопасность': ['Система стабилизации (ESP)', 'Подушка безопасности водителя', 'Крепление детского кресла (задний ряд) ISOFIX', 'Подушки безопасности оконные (шторки)', 'Подушка безопасности пассажира', 'Система предотвращения столкновения', 'Система контроля слепых зон', 'Подушки безопасности боковые', 'Антиблокировочная система (ABS)'], 'Мультимедиа': ['AUX', 'USB', 'Навигационная система', 'Bluetooth', 'Премиальная аудиосистема', 'Розетка 12V'], 'Обзор': ['Датчик света', 'Автоматический корректор фар', 'Датчик дождя', 'Светодиодные фары'], 'Салон': ['Регулировка передних сидений по высоте', 'Передний центральный подлокотник', 'Электрорегулировка передних сидений', 'Кожа (Материал салона)', 'Подогрев передних сидений', 'Отделка кожей рулевого колеса', 'Отделка потолка чёрной тканью'], 'Элементы экстерьера': ['Диски 20', 'Металлик'], 'Защита от угона': ['Сигнализация', 'Центральный замок', 'Иммобилайзер']}",полный,Левый,Не требует ремонта,1 владелец,Оригинал,Растаможен,,6000000
купе,bmw,серый,гибрид,2014,1.5hyb AT (231 л.с.) 4WD,BMW i8 I,2,2014,COUPE AUTOMATIC 1.5,автоматическая,1.5 LTR,231 N12,"Отличное состояние,обмен в приоритете на V класс ,S класс с доплатой в мою сторону. На обмен как у всех цена выше. Салоны просьба не беспокоить.",50 000 км,{},полный,Левый,Не требует ремонта,1 владелец,Оригинал,Растаможен,,4500000
родстер,bmw,белый,гибрид,2017,1.5hyb AT (231 л.с.) 4WD,BMW i8 Roadster I Рестайлинг,2,2019,ROADSTER AUTOMATIC 1.5,автоматическая,1.5 LTR,231 N12,"Автомобиль находится на площадке АО ABTODOM Зорге 17В Автодоме - Лучшее предложение на любую модель BMW.*обязательное предложение по трейд-ин*предложения по кредитуШирокий выбор а/м в разных цветах и комплектациях по самой привлекательной цене.     Дополнительные преимущества:Кредит с минимальной процентной ставкой от BMW Bank.Специальные условия страхованияБыстрый удобный и выгодной обмен Вашего автомобиля по рыночной стоимостиTrade-In Bonus———————————————————————————ФУНКЦИОНАЛЬНОЕ ОБОРУДОВАНИЕ———————————————————————————• Центральный замок (Автоматическое закрывание дверей при трогании с места)*• Комфортный доступ (бесключевой доступ в автомобиль (дверь водителя, дверь переднего пассажира))*• Светодиодные передние фары c расширенным функционалом*• Светодиодные дневные ходовые огни*• Внешние зеркала с обогревом*• Обогрев форсунок стеклоомывателей*• Подогрев передних сидений*• Неослепляющие, складывающиеся зеркала заднего вида с электроприводом*• Электрорегулировка передних сидений*• Зеркала заднего с функцией память: автоматическая парковочная функция (со стороны пассажира при включенной задней передаче)*• Аудиосистема HiFi Harman Kardon: 6 динамиков, сабвуфер, суммарная мощностью 360 Вт*• BMW Professional с функцией воспроизведения MP3 и DVD: DVD-привод, накопитель на жестком диске (20 Гб), Тройной тюнер с RDS*• Сигнализация аварийного сближения при парковке (спереди и сзади)*• Проекционный дисплей BMW*• Бортовой компьютер с расширенными функциями (расстояние до места назначения, рассчет времени до прибытия, и т.д.)*• BMW display key (Цветной ЖК-дисплей вкл. сенсорную панель управления, отображение параметров состояния автомобиля информации, контроль климатических функций, зарядное устройство, USB кабель)*• Навигационная система Professional с жестким диском: с цветным 8,8 -дюймовым сенсорным дисплеем с высоким разрешением (1280x480) и отображением трехмерной графики, функция быстрого старта и улучшенное ведение по маршруту. Навигация со спутниковыми изображениями, динамическое планирование маршрута с ведением к цели поездки с помощью голосовых указаний и карт, с поддержкой канала транспортных сообщений в режиме реального времени (RTTI)*• Интервал замены масла - 18 месяцев/15,000 км*• Без зарядного кабеля*• Сервисная книжка и инструкция на русском языке*• Пакет услуг BMW ConnectedDrive*• Пакет Travel*• BMW Service Inclusive*• BMW Repair Inclusive*• Русский язык*• Комфортная телефония с возможностью беспроводной зарядки*• Подготовка к Apple CarPlay*• Дистанционное управление автомобилем*• Консьерж-сервис*• Информация о дорожной ситуации онлайн*• Сервисы ConnectedDrive*• Функция интеллектуального экстренного вызова*• TeleServices*• Пакет освещения салона (светодиодная LED технология)*• Спидометр с обозначением километров*• Акустическое оповещение пешеходов*• Стандарт EU6*• Датчик света• Электростеклоподъёмники спереди• Электромеханический усилитель рулевого управления (EPS)• Регулировка руля по вылету и высоте• Мультифункция рулевого колеса• Автоматический климат-контроль 2-зонный, с расширенными функциями• Электрический дополнительный подогреватель салона• Динамический круиз-контроль• Запуск двигателя без ключа• Датчик дождя• Сертификат на высоковольтную батарею• Карта участника программы BMW i PURE IMPULSE• Кабель зарядки• Функция интеллектуального экстренного вызова• USB/AUX-вход• Телефония с расширенным подключением для смартфонов• Высоковольтная батарея• Система Dynamic Damper Control, регулирующая жесткость амортизаторов———————————————————————————БЕЗОПАСНОСТЬ———————————————————————————• Ассистент вождения*• Индикатор давления в шинах*• Охранная сигнализация с дистанционным управлением*• Знак аварийной остановки и аптечка*• Надувные шторки безопасности для водителя и переднего пассажира• Боковые подушки безопасности водителя и переднего пассажира• Фронтальные подушки безопасности водителя и переднего пассажира• Антиблокировочная система (ABS)• Система динамического контроля курсовой устойчивости DSC• Стояночный тормоз, электро-механический• Иммобилайзер———————————————————————————ИНТЕРЬЕР———————————————————————————• Обивка салона: Натуральная кожа Exclusive с акцентными вставками из ткани*• Цвет обивки сидений: коричневая дальбергия*• Цвет передней панели: коричневая дальбергия/Серый Карум*• Цвет коврового покрытия: черный*• Цвет потолка: черный*• BMW i дизайн интерьера Halo*• Керамическая отделка органов управления*• Ремни безопасности ярко-синего цвета BMW i*• Декоративные планки 'DryCarbon'*• Дополнительные приспособления для размещения вещей в салоне*• Ножные коврики, велюр*• Количество мест: 2• Тип сидений: Обычные• Солнцезащитное остекление• Спортивное кожаное рулевое колесо• Передний подлокотник• Отделка центральной консоли кожей Nappa———————————————————————————ЭКСТЕРЬЕР———————————————————————————• Кристально-белый с перламутровым эффектом / с синим акцентом BMW i*• BMW i легкосплавные диски Radial-spoke style 516*• Размер дисков: передние 7 J x 20, задние: 7.5 J × 20*• Упаковка*• Ремкомплект для шин (с электрическим компрессором 12 В)*• Шины передние 195/50 R20, задние 215/45 R20*• Тормозные суппорты, окрашенные*• Карбоновая крыша________* Дополнительные заводские опции.Комплектация «Base»:• Антиблокировочная система• Система курсовой устойчивости• Датчик давления в шинах• Подушки безопасности водителя• Подушки безопасности пассажиров, в том числе задних• Боковые передние подушки безопасности• Сигнализация• Иммобилайзер• Центральный замок• Бортовой компьютер• Круиз-контроль• Парктроник• Система контроля за полосой движения• Датчик света• Датчик дождя• Усилитель руля• Запуск двигателя с кнопки• Система доступа без ключа• Регулировка руля• Электрорегулировка сиденья водителя с памятью положения• Электрорегулировка сиденья пассажира с памятью положения• Электростеклоподъемники передние• Электропривод зеркал• Климат-контроль• Подогрев сидений водителя и пассажира• Обогрев зеркал• Обогрев форсунок стеклоомывателей• Навигационная система• TV• Мультифункциональное рулевое колесо• Кожаная обивка салона• Темный салон• Отделка потолка черной тканью• Кожаный руль• Литые легкосплавные диски• Размер дисков 20″• Светодиодные фары• Корректор фар",0,"{'Комфорт': ['Круиз-контроль', 'Мультифункциональное рулевое колесо', 'Активный усилитель руля', 'Электропривод зеркал', 'Парктроник передний', 'Парктроник задний', 'Электростеклоподъёмники передние', 'Проекционный дисплей', 'Бортовой компьютер', 'Система доступа без ключа', 'Запуск двигателя с кнопки', 'Регулировка руля по вылету', 'Регулировка руля по высоте', 'Климат-контроль 2-зонный', 'Электроскладывание зеркал'], 'Безопасность': ['Система стабилизации (ESP)', 'Система контроля за полосой движения', 'Подушка безопасности пассажира', 'ЭРА-ГЛОНАСС', 'Подушка безопасности водителя', 'Крепление детского кресла (задний ряд) ISOFIX', 'Подушки безопасности оконные (шторки)', 'Система предотвращения столкновения', 'Система контроля слепых зон', 'Подушки безопасности боковые', 'Датчик давления в шинах', 'Антиблокировочная система (ABS)'], 'Мультимедиа': ['USB', 'Мультимедиа система с ЖК-экраном', 'Навигационная система', 'CarPlay', 'Премиальная аудиосистема', 'Беспроводная зарядка для смартфона', 'AUX', 'Bluetooth', 'Розетка 12V'], 'Обзор': ['Электрообогрев форсунок стеклоомывателей', 'Дневные ходовые огни', 'Электрообогрев боковых зеркал', 'Светодиодные фары', 'Датчик света', 'Автоматический корректор фар', 'Датчик дождя'], 'Салон': ['Передний центральный подлокотник', 'Тёмный салон', 'Память передних сидений', 'Кожа (Материал салона)', 'Регулировка передних сидений по высоте', 'Электрорегулировка передних сидений', 'Подогрев передних сидений', 'Отделка кожей рулевого колеса', 'Отделка потолка чёрной тканью'], 'Элементы экстерьера': ['Рейлинги на крыше', 'Диски 20', 'Легкосплавные диски', 'Металлик'], 'Защита от угона': ['Центральный замок', 'Сигнализация', 'Иммобилайзер']}",полный,Левый,Не требует ремонта,0,Оригинал,Растаможен,0,12667200
